Clause,Label 1,Label 1-Answer,Label 2,Label 2-Answer
BLOCKCHAIN ADMINISTRATION AND DEVELOPMENT AGREEMENT,Document Name,BLOCKCHAIN ADMINISTRATION AND DEVELOPMENT AGREEMENT
"ARCA U.S. TREASURY FUND,, ""Fund"", ARCA CAPITAL MANAGEMENT, LLC, ""Blockchain Administrator"", ARCA CAPITAL MANAGEMENT, LLC, ""Fund"", ARCA U.S. TREASURY FUND,",Parties,"ARCA U.S. TREASURY FUND (""Fund""); ARCA CAPITAL MANAGEMENT, LLC (""Blockchain Administrator"")"
"[___], 2020",Agreement Date,[]/[]/2020
This Agreement shall become effective as of the first date above written,Effective Date,[]/[]/2020
"This Agreement shall continue in effect for two years from the date hereof, and thereafter shall continue automatically for successive annual periods, provided that such continuance is specifically approved at least annually by (A) the vote of the Board, or by the vote of a majority of the outstanding voting securities of the Fund and (B) the vote of a majority of the Fund's directors who are not parties to this Agreement or ""interested persons"" (as such term is defined in Section 2(a)(19) of the Investment Fund Act) of any such party, in accordance with the requirements of the Investment Fund Act.",Expiration Date,[]/[]/2022,Renewal Term,successive 1 year
"This Agreement shall be construed in accordance with the laws of the State of New York applicable to contracts formed and to be performed entirely within the State of New York, without regard to conflict of laws principles, and in accordance with the applicable provisions of the Investment Fund Act.",Governing Law,New York
"This Agreement may be terminated at any time, without the payment of any penalty, upon 60 days' written notice, by the vote of a majority of the outstanding voting securities of the Fund or by the vote of the Fund's Trustees or by the Blockchain Administrator.",Termination For Convenience,Yes
"This Agreement will automatically terminate in the event of its ""assignment"" (as such term is defined for purposes of Section 15(a) (4) of the Investment Fund Act).",Anti-assignment,Yes
"In full consideration of the provision of the services of the Blockchain Administrator set forth herein, the Fund shall pay the Blockchain Administrator a fees calculated at the annual rate of 0.20% of the value of the FundÕs average annual net assets.",Revenue/Profit Sharing,Yes
