Clause,Label 1,Label 1-Answer
JOINT VENTURE AGREEMENT,Document Name,JOINT VENTURE AGREEMENT
"BorrowMoney.com, inc, JVLS, LLC, (individually the ""Member"" and collectively the ""Members"", JVLS, LLC, BorrowMoney.com, inc",Parties,"BorrowMoney.com, inc.; JVLS, LLC (""Member"" and collectively the ""Members"")"
"20th day of Friday, March 2020",Agreement Date,03/20/2020
"The duration of this Venture (the ""Term"") will begin on March 1, 2020",Effective Date,03/01/2020
"The duration of this Venture (the ""Term"") will begin on March 1, 2020 and continue in full force and effect until February 28, 2025 or as otherwise provided in this Agreement.",Expiration Date,02/28/2025
"By this Agreement the Members enter into a joint venture (the ""Venture"") in accordance with the laws of the State of Florida.",Governing Law,(None entered)
"Assignment of Member status, under this clause, including any management and voting interests, will require the consent of all the remaining Members.",Anti-assignment,Yes
Accurate and complete books of account of the transactions of the Venture will be kept in accordance with generally accepted accounting principles (GAAP) and at all reasonable times will be available and open to inspection and examination by any Member.,Audit Rights,Yes
