Clause,Label 1,Label 1-Answer
AMENDMENT NO. 2,Document Name,AMENDMENT NO. 2
Wireless Content License Agreement Number 12965,Document Name,Wireless Content License Agreement Number 12965
"Fox Mobile Entertainment, Inc., ""Fox"", Glu Mobile, Inc. f/k/a Sorrent, Inc., ""Licensee"", Glu Mobile, Inc. f/k/a Sorrent, Inc., ""Fox"", Fox Mobile Entertainment, Inc.",Parties,"Fox Mobile Entertainment, Inc. (""Fox""); Glu Mobile, Inc. f/k/a Sorrent, Inc. (""Licensee"")"
"March 27, 2006",Agreement Date,03/27/2006
"In consideration of the rights granted to Licensee pursuant to this Amendment 2, Licensee shall pay to Fox, or such other party as Fox may designate in writing, a royalty in the following amount:   (a) From the first unit sold, Fox shall earn a royalty at the rate of ***** percent (*****%) of LicenseeÕs Gross Receipts (as defined in the Agreement) from LicenseeÕs sale and distribution of the IA2 Audio and Video Wireless Products.",Revenue/Profit Sharing,Yes
"Fox grants to Licensee a limited, non-exclusive right and license to distribute the following Wireless Products in connection with the Property ""ICE AGE: THE MELTDOWN"" in the United States: (A) 2 Scrat voicetones; (B) 2 John Leguizamo voicetones; and (C) 3 premium videos.",License Grant,Yes
"Fox also grants Licensee a limited, non-exclusive right and license to distribute the following Wireless Products in connection with the Property ""ICE AGE 2"" outside of the United States: (A) 4 Scrat voicetones; (B) 1 John Leguizamo voicetone; and (C) 3 premium videos. (collectively, ""IA2 Audio and Video Wireless Products"")",License Grant,Yes
