Clause,Label 1,Label 1-Answer,Label 2,Label 2-Answer
MEDIA LICENSE AGREEMENT,Document Name,MEDIA LICENSE AGREEMENT
"NATIONAL FOOTBALL MUSEUM, INC., doing business as Pro Football Hall of Fame, ""PFHOF"", HOF Village Media Group, LLC, ""Village Media Company"", HOF Village, LLC, ""HOFV"", HOF Village, LLC, ""Village Media Company"", HOF Village Media Group, LLC, ""PFHOF"", doing business as Pro Football Hall of Fame, NATIONAL FOOTBALL MUSEUM, INC.",Parties,"NATIONAL FOOTBALL MUSEUM, INC. d/b/a Pro Football Hall of Fame (""PFHOF""); HOF Village, LLC (""Village Media Company""); HOF Village, LLC (""HOFV"")"
the date of the Closing,Agreement Date,(None entered),Effective Date,(None entered)
"Unless otherwise terminated as provided herein, the term of this Agreement shall commence on the Effective Date and shall terminate on December 31, 2034 (such period, including as may be extended in accordance with the subsequent sentence, the ""Term"").",Expiration Date,12/31/2034
"Thereafter, the agreement shall automatically renew for successive five (5)-year terms, unless either Party gives written notice to the other Party of intent not to renew at least six (6) months prior to the expiration of the then-current Term., If either party elects not to renew the Agreement and the other party wishes to continue the Agreement, the Parties shall attempt in good faith to negotiate an amendment to the Agreement to renew the Term on such terms as may be negotiated by the Parties., Thereafter, the agreement shall automatically renew for successive five (5)-year terms, unless either Party gives written notice to the other Party of intent not to renew at least six (6) months prior to the expiration of the then-current Term.",Renewal Term,successive 5 years
"Thereafter, the agreement shall automatically renew for successive five (5)-year terms, unless either Party gives written notice to the other Party of intent not to renew at least six (6) months prior to the expiration of the then-current Term.",Notice Period To Terminate Renewal,180 days / 6 months
"This Agreement will be governed in all respects by the laws of the State of Ohio (without regard to conflicts of law provisions), as such laws are applied to agreements entered into and to be performed entirely within the State of Ohio between Ohio residents.",Governing Law,Ohio
"If the Village Media Company does not exercise its right of first refusal, PFHOF shall have the right to grant a license with respect to such third party on the same terms originally provided to the Village Media Company.",Most Favored Nation,Yes,ROFR/ROFO/ROFN,Yes
"All communication with the National Football League (the ""NFL""), its 32 Member Clubs, NFL Legends and Gold Jackets shall be made exclusively and directly through PFHOF.",Exclusivity,Yes
"For the avoidance of doubt, PFHOF has the exclusive and sole relationship with the NFL, its 32 Member Clubs, NFL Legends and Gold Jackets for any and all PFHOF and HOFV activities_ provided, however, that any communication relating to any investment by the NFL in any Village Media Company project, may be made directly through the President of PFHOF or the Chief Executive Officer of HOFV_ and, provided further, that the Village Media Company shall have the right to present opportunities related to any of the above for approval by PFHOF.",Exclusivity,Yes
"PFHOF agrees not to grant licenses to create new PFHOF Works, except with respect to the categories identified on Exhibit A, to any third party during the Term without first offering to the Village Media Company the right of first refusal to create such PFHOF Works on equal terms, subject to any Rights Restrictions.",ROFR/ROFO/ROFN,Yes
"If PFHOF desires to offer a license to any third party or if it receives any bona fide offer from a third party that it is willing to accept, it shall promptly communicate such offer, including the specific terms and business plan relating to such offer, to the Village Media Company and provide the Village Media Company with at least fourteen (14) days to exercise its right of first refusal.",ROFR/ROFO/ROFN,Yes
"If the Village Media Company elects to exercise its right of first refusal, the terms of the offer shall apply, the applicable license shall be subject to the terms and conditions of this Agreement and the Village Media Company shall pay to PFHOF a License Fee (as defined below) for such license in accordance with this Agreement.",ROFR/ROFO/ROFN,Yes
"PFHOF agrees that during the Term, except with respect to the categories identified on Exhibit A, it will not create new PFHOF Works without first granting the Village Media Company a right of first offer to create such PFHOF Work, subject to any Rights Restrictions.",ROFR/ROFO/ROFN,Yes
"PFHOF agrees that during the Term, except with respect to the categories identified on Exhibit A, if PFHOF desires to either exploit itself or license a third party to exploit an existing PFHOF Work, it shall first give the Village Media Company a right of first offer to exclusively license such PFHOF Work, subject to any Rights Restrictions.",ROFR/ROFO/ROFN,Yes
"In such a case, PFHOF shall promptly notify the Village Media Company and provide the Village Media Company with any bona fide third party offer to license such PFHOF Work that PFHOF is willing to accept, including any specific terms and proposed business plan relating to such offer.",ROFR/ROFO/ROFN,Yes
"In addition to and without limiting any other provision of this Agreement, in the event the Village Media Company or HOFV fails to pay the Annual Guarantee to PFHOF in accordance with Section 5.1 and such failure is not cured within thirty (30) days of notice thereof by PFHOF, then the rights of first offer granted to HOFV in Section 3.1 of the First Amended and Restated License Agreement, dated as of September 16, 2019 between PFHOF and HOFV (the ""License Agreement"") shall automatically and immediately terminate, regardless of whether PFHOF elects not to terminate this Agreement in accordance Section 4.2.",ROFR/ROFO/ROFN,Yes
"In addition to and without limiting any other provision of this Agreement, if a Change of Control occurs at any time during the Term, PFHOF shall have the right to terminate this Agreement immediately upon giving notice of such termination to the Village Media Company.",Change of Control,Yes
"For purposes of this Section 4.4, a ""Change of Control"" shall mean any transaction or series of related transactions that results in (including by way of merger or consolidation), or that is in connection with, the Village Media Company no longer being controlled (as defined in Section 1.2) by or under common control (as defined in Section 1.2) with HOFV.",Change of Control,Yes
"The Village Media Company shall not, directly or indirectly, assign, sublicense or otherwise transfer any of its rights or obligations hereunder without the prior written consent of PFHOF.",Anti-assignment,Yes
"To the extent that the Village Media Company and PFHOF work collaboratively on media projects, the EPÕs services on such projects for the benefit of PFHOF shall be charged to PFHOF at cost without markup.",Price Restrictions,Yes
"The Parties acknowledge and agree that two hundred twenty five thousand dollars ($225,000) (the ""Youth Sports License Fee"") shall be credited against the Annual Guarantee on the Closing Date and each anniversary of the Closing Date during the Term for the license granted by PFHOF to Youth Sports Management, LLC (""Youth Sports"") pursuant to that certain branding license agreement to be entered into on the Effective Date between PFHOF and Youth Sports for so long as such agreement remains in effect_ provided that after the first five (5) years of the Term, the Youth Sports License Fee shall increase by three percent (3%) on a year-over year basis and thereafter, the aggregate amount of the Youth Sports License Fee, after giving effect to such increase each year, shall be the amount credited against the Annual Guarantee.",Price Restrictions,Yes
"Subject to Section 2.6, the Village Media Company shall, or shall cause HOFV to, pay to PFHOF a minimum guarantee of one million two hundred and fifty thousand dollars ($1,250,000) (the ""Annual Guarantee"") each year during the Term_ provided that the Parties acknowledge and agree that after the first five (5) years of the Term, the Annual Guarantee shall increase by three percent (3%) on a year-over-year basis (e.g., the Annual Guarantee shall increase to $1,287,500 for year six (6) and to $1,326,125 for year seven (7)).",Minimum Commitment,Yes
"Any HOFV Works created pursuant to this Agreement shall exclusively be owned by the Village Media Company; provided, however, that, (i) PFHOF shall own all right, title, interest, and copyright in and to the underlying PFHOF Work(s) as further set forth in Section 2.5 and (ii) the Village Media CompanyÕs ownership is subject in all events to any Rights Restrictions and the terms of the license (including the term of such license) granted by PFHOF in connection with such HOFV Work pursuant to Section 2.3.",IP Ownership Assignment,Yes
"The Village Media Company agrees, on behalf of itself and its Affiliates and their permitted sublicensees, that all uses by the Village Media Company or any of its Affiliates or their respective permitted sublicensees of the PFHOF Work shall inure to the benefit of PFHOF, and any right that may accrue to the Village Media Company, any of its Affiliates or any of their respective permitted sublicensees related thereto and any goodwill associated therewith are hereby granted and assigned to PFHOF or its designee",IP Ownership Assignment,Yes
"Subject to the terms of this Agreement (including, without limitation, Sections 2.3, 2.4, 2.6 and 5 below), PFHOF hereby grants to the Village Media Company a worldwide, non-exclusive, limited, non-sublicenseable and non-assignable (except to the extent set forth in this Agreement) right and license to (a) Exploit the PFHOF Works and (b) edit, supplement or otherwise adapt, incorporate or otherwise utilize, the PFHOF Works to create, produce and Exploit new, original work(s) (each such work in this clause (b), a ""HOFV Work"").",License Grant,Yes,Non-Transferable License,Yes
"In addition to any rights set forth herein, PFHOF shall have the right and license to Exploit HOFV Works, at no fee or charge to PFHOF or any of its Affiliates, for educational, not-for-profit purposes aligned with the mission of PFHOF which usage shall not diminish the value of the Village Media CompanyÕs or its AffiliatesÕ Exploitation of such HOFV Work in accordance with the terms of this Agreement.",License Grant,Yes
"For the avoidance of doubt, nothing in this Agreement shall grant Village Media Company or its Affiliates the right or license to (i) any live (or near live) rights to Exploit any events or other content owned or controlled by PFHOF (e.g., Enshrinement Ceremonies), or (ii) any programming or content in connection with or related to any Enshrinement Ceremony or the Enshrinement selection process (e.g., selection meetings, voting, debates or discussions prior to or during any selection meeting, presenter speeches, discussions or events immediately after Enshrinement Ceremonies, etc.).",License Grant,Yes
"The Village Media Company shall have the right to sublicense (a) the production and creation of the HOFV Works and (b) Exploitation of the PFHOF Works hereunder to any of its Affiliates_ provided, that, Village Media Company shall (x) cause such sublicenses to comply with all terms and conditions of this Agreement and (y) not be relieved of any of its obligations under this Agreement as a result of any such sublicense, and will be primarily responsible for any acts or omissions of such sublicensees.",Affiliate License-Licensee,Yes
"For the avoidance of doubt, after the termination or expiration of this Agreement, the Village Media Company and its permitted licensees shall continue to have the right to fully exploit, use, and Exploit the HOFV Works for the length of the term of the license granted by PFHOF in connection with such HOFV Work pursuant to Section 2.3; provided that the length of the term of such license shall be a minimum of five (5) years.",Post-termination Services,Yes
The Village Media Company shall be permitted to retain copies of PFHOFÕs Confidential Information as necessary to allow the Village Media Company to exercise its post-termination rights with respect to such information.,Post-termination Services,Yes
"The Village Media Company shall not, and shall cause its Affiliates and their respective permitted sublicensees not to, whether during the Term or thereafter, challenge (a) the rights of PFHOF in and to any PFHOF Work, (b) the validity of any PFHOF Work, (c) PFHOFÕs right to grant rights or licenses relating to the PFHOF Works or (d) the validity, legality, or enforceability of this Agreement.",Covenant Not To Sue,Yes
