Clause,Label 1,Label 1-Answer,Label 2,Label 2-Answer
CO-BRANDING AGREEMENT,Document Name,CO-BRANDING AGREEMENT
"Lucent Technologies Inc., ""Lucent"", mPhase Technologies Inc., ""mPhase"", (each individually, ""a Party"" and, collectively, ""the Parties""}., ""mPhase"", mPhase Technologies Inc., ""Lucent"", Lucent Technologies Inc.",Parties,"Lucent Technologies Inc. (""Lucent""); mPhase Technologies Inc. (""mPhase"")(""a Party"" and collectively, ""the Parties"")"
21st day of January 2003,Agreement Date,01/21/2003
"The Term of this Agreement will commence on the date above, and shall          continue for a term of one (1) year",Expiration Date,1/21/2004
"mPhase shall have the right to          annually renew this agreement for a period of one year upon each annual          expiration with the written consent of Lucent, which written consent          shall not be unreasonably withheld.",Renewal Term,successive 1 year
Either party wishing to terminate          the Agreement must give written notice to the other party at least          thirty (30) days prior to the desired date of termination.,Notice Period To Terminate Renewal,30 days,Termination For Convenience,Yes
"The validity, construction and performance of this Agreement shall be          governed by the laws of the State of New York.",Governing Law,New York
This Agreement shall terminate in the event of a significant change in          the management or ownership of mPhase or in the event mPhase is the          subject of any bankruptcy proceedings.,Change of Control,Yes
This Agreement shall not be assigned by mPhase without the prior          written consent of Lucent.,Anti-assignment,Yes
"Neither Party shall be liable to the other for special, incidental, or          consequential damages, even if such Party has been advised of the          possibility of such damages.",Cap on Liability,Yes
