Clause,Label 1,Label 1-Answer,Label 2,Label 2-Answer
Strategic Alliance Agreement,Document Name,Strategic Alliance Agreement
"Bravatek Solutions, Inc., ""Bravatek"", Sibannac, Inc., ""COMPANY"", Sibannac, Inc., ""Bravatek"", Bravatek Solutions, Inc.",Parties,"Bravatek Solutions (""Bravatek""); Sibannac Inc. (""COMPANY"")"
"30th day of November, 2017",Agreement Date,11/30/2017
"The term of this Agreement is twelve (12) months from the date hereof, and will be automatically renewed for one (1) additional twelve month period unless either party shall notify the other in writing of its intention not to renew.",Expiration Date,11/30/2018,Renewal Term,12 months
"The term of this Agreement is twelve (12) months from the date hereof, and will be automatically renewed for one (1) additional twelve month period unless either party shall notify the other in writing of its intention not to renew. Such notice must be given ninety (90) days prior to expiration of the original term.",Notice Period To Terminate Renewal,90 days
This Agreement is entered into in the State of Texas and shall be interpreted according to the laws of the State of Texas.,Governing Law,Texas
This Agreement may also be terminated by either party upon ninety (90) days written notice.,Termination For Convenience,Yes
This Agreement shall not be assignable by either party without the prior written consent of the other party.,Anti-assignment,Yes
"For any Product or Solution sold to any perspective clients introduced by Bravatek registered with COMPANY via email to COMPANY's CEO and delivered through Bravatek or a COMPANY-designated distribution affiliate(s) or sales channel(s), Bravatek will receive a lead-finder fee, to be mutually discussed and finally decided by COMPANY at the range of minimum of 10% to maximum of 20% of project revenue, with an exact fee to be depending upon the overall project sales margin and cost of development and delivery of each project, payable NET 30 days after each client payment on delivered products received at COMPANY's bank account.",Revenue/Profit Sharing,Yes
