Clause,Label 1,Label 1-Answer
TRANSPORTATION SERVICE AGREEMENT Contract Identification FT18150,Document Name,TRANSPORTATION SERVICE AGREEMENT Contract Identification FT18150
"Great Lakes Gas Transmission Limited Partnership, Transporter, ANR PIPELINE COMPANY, Shipper, ANR PIPELINE COMPANY, Transporter, Great Lakes Gas Transmission Limited Partnership",Parties,"Great Lakes Gas Transmission Limited Partnership (""Transporter""); ANR PIPELINE COMPANY (""Shipper"")"
"December 14, 2015",Agreement Date,12/14/2015
"EFFECTIVE DATE: November 01, 2016",Effective Date,11/01/2016
"TERM: November 01, 2014 to October 31, 2017",Expiration Date,10/31/2017
Any controversy between the parties arising under this Agreement and not resolved by the parties shall be determined in accordance with the laws of the State of Michigan.,Governing Law,Michigan
"MAXIMUM DAILY QUANTITY (Dth/Day): 101,300",Volume Restriction,Yes
"Maximum Daily Quantity (Dth/Day) per Location: Begin Date End Date Point(s) of Primary Receipt Point(s) of Primary Delivery MDQ Maximum Allowable Operating Pressure (MAOP) 11/01/2014 03/31/2015 SOUTH CHESTER 101,300 974 11/01/2014 03/31/2015 DEWARD 101,300 974 04/01/2015 10/31/2015 SOUTH CHESTER 0 974 11/01/2015 03/31/2016 SOUTH CHESTER 101,300 974 11/01/2015 03/31/2016 DEWARD 101,300 974 04/01/2016 10/31/2016 SOUTH CHESTER 0 974 11/01/2016 03/31/2017 SOUTH CHESTER 101,300 974 11/01/2016 03/31/2017 DEWARD 101,300 974 04/01/2017 10/31/2017 SOUTH CHESTER 0 974 11/01/2014 03/31/2015 FARWELL 101,300 974 04/01/2015 10/31/2015 FARWELL 0 974 11/01/2015 03/31/2016 FARWELL 101,300 974 04/01/2016 10/31/2016 FARWELL 0 974 11/01/2016 03/31/2017 FARWELL 101,300 974 04/01/2017 10/31/2017 FARWELL 0 974",Volume Restriction,Yes
