Clause,Label 1,Label 1-Answer
JOINT VENTURE AGREEMENT,Document Name,JOINT VENTURE AGREEMENT
"Aizu Fujitsu Semiconductor Limited, ""AFSL"", Japan, Fujitsu Semiconductor Limited, ""FSL"", Transphorm, Inc., ""TPH"", collectively referred to as the ""Parties"" and individually, a ""Party"", ""TPH"", Transphorm, Inc., ""FSL"", Japan, Fujitsu Semiconductor Limited, ""AFSL"", Aizu Fujitsu Semiconductor Limited",Parties,"AizuFujitsu Semiconductor Limited (""AFSL""); Fujitsu Semiconductor Limited (""FSL""); Transphorm, Inc. (""TPH"")(""Parties"" and individually, a ""Party"")"
"this 23rd day of May, 2017",Agreement Date,05/23/2017
"""Effective Date"" means the date that the Initial Closing occurs.",Effective Date,(None entered)
"The English text of this Agreement shall control any interpretation of its provisions, and this Agreement and the legal relations among the Parties and the Company shall in all respects be interpreted, construed and governed by and in accordance with the laws of Japan.",Governing Law,Japan
"At TPHÕs sole option, TPH or TPH-A may purchase the GaN Equipment by completion of payment of the purchase price or depreciation cost for such equipment as set forth in Appendix 2.",ROFR/ROFO/ROFN,Yes
"If, after the Effective Date, TPH or TPH-A shall have materially breached any of its representations or warranties contained in this Agreement or shall have failed to comply in any material respect with any of the other covenants or agreements contained in this Agreement, which breach or failure shall not have been remedied within thirty (30) days after written notice thereof (the ""Default Notice"") has been given by AFSL to TPH/TPH-A, then AFSL shall have the option of purchasing from TPH-A, and TPH-A shall be obligated to sell, all of the Shares then owned by TPH-A at a purchase price per Share equal to the lesser of: (i) the Net Book Value as of the most recent month end (provided that, if the Net Book Value is a negative amount, the product of the Net Book Value multiplied by such Sale Shares shall be deemed to be one Japanese Yen (´1)), or (ii) the Shares Purchase Price, divided by the number of Sale Shares. AFSL shall provide written notice of its election (the ""Election Notice"") to purchase the Shares owned by TPH-A within ten (10) Business Days following the expiration of the thirty (30) day cure period set forth in the Default Notice. The closing of the purchase of the Shares owned by TPH-A - 17-Confidential Execution Version shall take place within thirty (30) Business Days following the date of the Election Notice, or at such other time as the Parties may mutually agree. At such closing, AFSL shall deliver to TPH-A, by wire transfer, the full amount of the purchase price in Japanese Yen for such Shares as provided in this Section 7.5.1 against delivery by TPH-A of the following: (a) a sale agreement in form reasonably satisfactory to AFSL containing among other things, a representation and warranty of TPH-A that it is, and AFSL shall be, the beneficial owner of such Shares, with good title thereto, free and clear of all liens and other encumbrances_ (b) documentary evidence reasonably satisfactory to AFSL of the transfer to it of all of TPH-AÕs Shares and (c) resignations of all Directors, if any, on the Board appointed by TPH-A. Notwithstanding the remedies provided in this Section 7.5.1, AFSL/FSL shall be entitled to all other remedies against TPH/TPH-A available at law or equity or under this Agreement.",ROFR/ROFO/ROFN,Yes
"If, after the Effective Date, TPH or TPH-A shall have materially breached any of its representations or warranties contained in this Agreement or shall have failed to comply in any material respect with any of the other covenants or agreements contained in this Agreement, which breach or failure shall not have been remedied within thirty (30) days after written notice thereof (the ""Default Notice"") has been given by AFSL to TPH/TPH-A, then AFSL shall have the option of purchasing from TPH-A, and TPH-A shall be obligated to sell, all of the Shares then owned by TPH-A at a purchase price per Share equal to the lesser of: (i) the Net Book Value as of the most recent month end (provided that, if the Net Book Value is a negative amount, the product of the Net Book Value multiplied by such Sale Shares shall be deemed to be one Japanese Yen (´1)), or (ii) the Shares Purchase Price, divided by the number of Sale Shares. AFSL shall provide written notice of its election (the ""Election Notice"") to purchase the Shares owned by TPH-A within ten (10) Business Days following the expiration of the thirty (30) day cure period set forth in the Default Notice. The closing of the purchase of the Shares owned by TPH-A shall take place within thirty (30) Business Days following the date of the Election Notice, or at such other time as the Parties may mutually agree. At such closing, AFSL shall deliver to TPH-A, by wire transfer, the full amount of the purchase price in Japanese Yen for such Shares as provided in this Section 7.5.1 against delivery by TPH-A of the following: (a) a sale agreement in form reasonably satisfactory to AFSL containing among other things, a representation and warranty of TPH-A that it is, and AFSL shall be, the beneficial owner of such Shares, with good title thereto, free and clear of all liens and other encumbrances_ (b) documentary evidence reasonably satisfactory to AFSL of the transfer to it of all of TPH-AÕs Shares and (c) resignations of all Directors, if any, on the Board appointed by TPH-A. Notwithstanding the remedies provided in this Section 7.5.1, AFSL/FSL shall be entitled to all other remedies against TPH/TPH-A available at law or equity or under this Agreement.",ROFR/ROFO/ROFN,Yes
"If, after the Effective Date, FSL or AFSL shall have materially breached any of its representations or warranties contained in this Agreement or shall have failed to comply in any material respect with any of the other covenants or agreements contained in this Agreement, which breach or failure shall not have been remedied within thirty (30) days after the Default Notice has been given by TPH-A to FSL/AFSL, then TPH-A shall have the option of purchasing from AFSL, and AFSL shall be obligated to sell, all of the Shares then owned by AFSL at a purchase price per Share equal to the lesser of: (i) the Net Book Value as of the most recent month end (provided that, if the Net Book Value is a negative amount, the product of the Net Book Value multiplied by such Sale Shares shall be deemed to be one Japanese Yen (´1)), or (ii) the Shares Purchase Price, divided by the number of Sale Shares. TPH-A shall provide the Election Notice to purchase the Shares owned by AFSL within ten (10) Business Days following the expiration of the thirty (30) day cure period set forth in the Default Notice. The closing of the purchase of the Shares owned by AFSL shall take place within thirty (30) Business Days following the date of the Election Notice, or at such other time as the Parties may mutually agree. At such closing, TPH-A shall deliver to AFSL, by wire transfer, the full amount of the purchase price in Japanese Yen for such Shares as provided in this Section 7.5.2 against delivery by AFSL of the following: (a) a sale agreement in form reasonably satisfactory to TPH-A containing among other things, a representation and warranty of AFSL that it is, and TPH-A shall be, the beneficial owner of such Shares, with good title thereto, free and clear of all liens and other encumbrances_ (b) documentary evidence reasonably satisfactory to TPH-A of the transfer to it of all of AFSLÕs Shares and (c) resignations of all Directors, if any, on the Board appointed by AFSL. Notwithstanding the remedies provided in this Section 7.5.2, TPH/TPH-A shall be entitled to all other remedies against FSL/AFSL available at law or equity or under this Agreement.",ROFR/ROFO/ROFN,Yes
"As longs as AFSL and FSL are not in material and continuing breach of this Agreement or the Ancillary Agreements, FSL or AFSL may trigger the option to sell the Put Shares to TPH-A or its designee (the ""Put Option"") by providing a written notice of the exercise of the Put Option (the ""Put Exercise Notice"") simultaneously to the Company, TPH and TPH-A, which notice states (i) such PartyÕs bona fide intention to exercise the Put Option, and (ii) the date on which such Party intends that the Put Closing Date occur.",ROFR/ROFO/ROFN,Yes
"FSL or AFSL may not exercise the Put Option for less than one hundred percent (100%) of the Shares held by both FSL and AFSL or any Affiliate of FSL or AFSL, as the case may be.",ROFR/ROFO/ROFN,Yes
FSL and AFSL may not exercise the Put Option prior to the Option Starting Date nor more than one hundred eighty (180) days after the Option Starting Date.,ROFR/ROFO/ROFN,Yes
"The purchase price for the Put Shares (the ""Put Option Price"") shall be the greater of (x) the amount in Japanese Yen equal to the Net Book Value as of the most recently completed month end prior to the Put Closing Date, minus the Net Book Value as of the most recently completed month end prior to the Effective Date, multiplied by the number of Put Shares, or (y) one Japanese Yen (´1).",ROFR/ROFO/ROFN,Yes
"Upon FSLÕs or AFSLÕs exercise of the Put Option, TPH-A shall be obliged to purchase or cause TPH-AÕs designees to purchase, and TPH shall be obliged to cause TPH-A or TPH-AÕs designees to purchase, the Put Shares in accordance with this Section 9.1. For the avoidance of doubt, the Put Option is the right of AFSL/FSL, and AFSL/FSL is not obliged to exercise the Put Option.",ROFR/ROFO/ROFN,Yes
"Completion of the sale and purchase of the Put Shares pursuant to the exercise of the Put Option by AFSL/FSL shall take place on the date specified in the Put Exercise Notice (which shall be a date after at least sixty (60) days from the date of the Put Exercise Notice) (the ""Put Closing Date"") and on which date: (i) TPH-A shall, or shall cause its designees to, and TPH shall cause TPH-A or TPH-AÕs designees to, pay to AFSL the Put Option Price for the Put Shares by way of a bank transfer to the bank account as separately designated by AFSL_ and (ii) in exchange for which, AFSL shall deliver to TPH-A or its designees duly executed a letter of request to enter in the shareholder register of the Company the information that is required to be registered with regard to the Put Shares_ and",ROFR/ROFO/ROFN,Yes
AFSL and TPH-A shall cause the Board to approve the share transfer of the Put Shares on or prior to the Put Closing Date.,ROFR/ROFO/ROFN,Yes
"As longs as TPH-A and TPH are not in material and continuing breach of this Agreement or the Ancillary Agreements, TPH-A or TPH may trigger the option to purchase the Call Shares (the ""Call Option"") by providing a written notice of the exercise of the Call Option (the ""Call Exercise Notice"") simultaneously to the Company, FSL and AFSL, which notice states (i) such PartyÕs bona fide intention to exercise the Call Option, and (ii) the date on which such Party intends that the Call Closing Date occur.",ROFR/ROFO/ROFN,Yes
"TPH or TPH-A may not exercise the Call Option for less than one hundred percent (100%) of the Shares held by both FSL and AFSL or any Affiliate of FSL or AFSL, as the case may be.",ROFR/ROFO/ROFN,Yes
TPH-A and TPH may not exercise the Call Option prior to the Option Starting Date nor more than one hundred eighty (180) days after the Option Starting Date.,ROFR/ROFO/ROFN,Yes
"The purchase price for the Call Shares (the ""Call Option Price"") shall be the greater of (x) the amount in Japanese Yen equal to the Net Book Value as of the most recently completed month end prior to the Call Closing Date, minus the Net Book Value as of the most recently completed month end prior to the Effective Date, multiplied by the number of Call Shares, or (y) one Japanese Yen (´1).",ROFR/ROFO/ROFN,Yes
"Upon TPH-AÕs or TPHÕs exercise of the Call Option, AFSL/FSL shall be obliged to sell, or cause the holder of the Call Shares to sell, the Call Shares to TPH-A or its designee in accordance with this Section 9.2. For the avoidance of doubt, the Call Option is the right of TPH-A and TPH-A is not obliged to exercise the Call Option.",ROFR/ROFO/ROFN,Yes
"Completion of the sale and purchase of the Call Shares pursuant to the exercise of the Call Option by TPH- A/TPH shall take place on the date specified in the Call Exercise Notice (which shall be a date after at least sixty (60) days from the date of the Call Exercise Notice) (the ""Call Closing Date"") and on which date: (i) TPH-A shall, or shall cause its designees to, and TPH shall cause TPH-A or TPH-AÕs designees to, pay to AFSL the Call Option Price for the Call Shares by way of a bank transfer to the bank account as separately designated by AFSL_ and (ii) in exchange for which, AFSL shall deliver to TPH-A or its designees duly executed a letter of request to enter in the shareholder register of the Company the information that is required to be registered with regard to the Call Shares.",ROFR/ROFO/ROFN,Yes
AFSL and TPH-A shall cause the Board to approve the share transfer of the Call Shares on or prior to the Call Closing Date.,ROFR/ROFO/ROFN,Yes
"Each PartyÕs obligation to complete the Put Option or Call Option at the Put Closing Date or Call Closing Date, as applicable, is subject to the fulfillment on or before such Put Closing Date or Call Closing Date of each of the following conditions, unless waived in writing (where permissible) by the applicable party in such closing:",ROFR/ROFO/ROFN,Yes
"(v) By FSL/AFSL and TPH/TPH-A, if there is a change in the Control of the other and the acquiring/succeeding entity causing such change in the Control is an entity that may be reasonably believed to be objectionable to the Japanese Government and/or FSL including FSLÕs Affiliates in case of the termination by FSL/AFSL or the US Government and/or TPH in case of the termination by TPH/TPH-A, termination to be effective upon thirty (30) daysÕ notice of termination.",Change of Control,Yes
"Except as set forth in this Article VIII, prior to the Option Starting Date, without the prior written consent of the other Shareholders, no Shareholder may sell, assign, transfer, pledge, encumber or otherwise dispose of, by operation of Law or otherwise, any of its Shares, or rights in or associated with such Shares, and any purported sale, assignment, transfer, pledge, encumbrance or disposition by a Shareholder of its Shares in violation of this Article VIII shall be invalid and of no force and effect.",Anti-assignment,Yes
"AFSL shall be entitled at any time to transfer all but not a portion of the Shares registered in its name to FSL or any other entity Controlled by FSL, and TPH-A shall be entitled at any time to transfer all but not a portion of the Shares registered in its name to TPH or any other entity Controlled by TPH_ provided that FSL (or such other entity Controlled by FSL) and TPH (or such other entity Controlled by TPH), as applicable, shall assume the obligations of AFSL and TPH-A, as applicable, hereunder, as set forth in Article VI.",Anti-assignment,Yes
"Notwithstanding the foregoing, no rights, obligations or liabilities hereunder shall be assignable by a Party without prior written consent of all of the other Parties_ provided, however, that a Party shall not unreasonably withhold its consent to the assignment of rights and obligations by the other Parties to its Affiliate if that AffiliateÕs performance has been guaranteed satisfactorily in form and substance by the assigning Party.",Anti-assignment,Yes
"The Parties expect the Company to comply with the Business Plan_ provided, however, deviations from the Business Plan that result in an increase or decrease of less than twenty percent (20%) of the original cost or revenue to the Company attributable to such item as set forth in the Business Plan shall not require the consent of the Parties, so long as all such deviations in any given quarter do not represent a deviation of more than ten percent (10%) of total revenue or total expense, as the case may be, in the aggregate for the quarter in which the deviation occurs.",Revenue/Profit Sharing,Yes
"In such case: (i) TPH-A or TPH, as the case may be, shall acquire sole and exclusive title to the GaN Equipment, free and clear of all Encumbrances, and none of FSL, AFSL or the Company shall have any right, title or interest in such GaN Equipment, (ii) such GaN Equipment shall be clearly labeled as the property of TPH-A or TPH, as the case may be, and (iii) FSL and AFSL shall cause to be assigned to TPH-A or TPH, as the case may be, all licenses and warranties for such GaN Equipment and the software or firmware required to operate such GaN Equipment that are attached to, installed on, or embodied in such GaN Equipment as of the Effective Date. During the term if this Agreement, the GaN Equipment shall be used exclusively in GaN wafer processing, and shall not be used in the silicon wafer processing for AFSLÕs or FSLÕs current products.",IP Ownership Assignment,Yes
"The Parties shall cause the Company to deliver to each Party, at the CompanyÕs expense, (i) annual audited and quarterly and monthly unaudited financial statements prepared in accordance with Japanese GAAP consistently applied, including any independent auditorÕs report or opinion thereon, if any, and (ii) any information necessary to enable a Party to prepare consolidated financial statements, in each case within sixty (60) days after the end of each fiscal year of the Company and within thirty (30) days after the end of each quarterly accounting period of the Company and calendar month. Each Party will indemnify the Company and hold it harmless for, from and against any claims, demands, costs or expenses arising out of or relating to such consolidated financial statements, provided that such indemnity shall not apply to claims, demands, costs or expenses to the extent they are related to the CompanyÕs financial statements provided to such Party.",Audit Rights,Yes
"In addition to any inspection rights granted under Law, upon notice to the Company of at least twenty-four (24) hours, each Party shall have full access to all properties, books of account, and records of the Company.",Audit Rights,Yes
"In case it is necessary for AFSL/FSL to access to any materials or information of the Company prepared or otherwise made on or before the Put Closing Date or the Call Closing Date due to requirement by any Governmental Authority or any third party on or after the Put Closing Date or the Call Closing Date, then, TPH/TPH-A shall fully cooperate, and shall cause the Company to fully cooperate, with AFSL/FSL so that AFSL/FSL can access such materials or information.",Audit Rights,Yes
